title,track,mode,region,level,deadline,description,format,eligibility,howToApply,tags,applyUrl,officialUrl
"Canadian High Schools Model United Nations (CAHSMUN)","MUN","In-Person","Canada","High School","TBA (see official listing)","CAHSMUN is one of the flagship Canadian high school MUN conferences and a serious training ground for delegates who want fast paced debate without the intimidation factor of the US mega conferences. It attracts strong school delegations and rewards clear policy thinking, disciplined procedure, and coalition building. If you want a reputable North American conference with a competitive but educational vibe, CAHSMUN is a classic pick.","Committee sessions -> Draft resolutions -> Negotiation blocs -> Voting and awards (committee offerings vary by year)","High school students (typically Grade 8-12); school delegations and independent delegates depending on conference policy","1. Open the official listing. 2. Locate the CAHSMUN page or host link. 3. Register a delegation or individual account if offered. 4. Pay fees if required. 5. Submit country and committee preferences by the posted deadline.","mun|high-school|canada|debate|diplomacy","https://en.wikipedia.org/wiki/List_of_model_United_Nations_conferences","https://en.wikipedia.org/wiki/List_of_model_United_Nations_conferences"
"Canada International Model United Nations (CAIMUN)","MUN","In-Person","Canada","High School","TBA (see official listing)","CAIMUN is positioned as an internationally oriented Canadian conference and is a strong option for students who want global themed committees and a diverse delegate pool. It is often chosen by schools building a balanced MUN season because it blends skills building with meaningful competition. Expect solid chairing standards and plenty of opportunities to practice both formal speeches and informal negotiation.","Opening session -> Committee debates -> Working papers -> Draft resolutions -> Voting and awards","High school students (typically Grade 8-12); school delegations and independent delegates depending on conference policy","1. Open the official listing. 2. Find CAIMUN details and host page. 3. Register delegation or individual entry as allowed. 4. Confirm payment and assignments. 5. Prepare position paper if required.","mun|high-school|canada|international|policy","https://en.wikipedia.org/wiki/List_of_model_United_Nations_conferences","https://en.wikipedia.org/wiki/List_of_model_United_Nations_conferences"
"Ontario Model United Nations (OMUN)","MUN","In-Person","Canada","High School","TBA (see official site)","OMUN is a well known Ontario circuit conference that many schools treat as a major milestone in the season because it is competitive, structured, and reliably organized. It is a great place to sharpen real committee skills like drafting, merging, and negotiating under time pressure. If you want a conference that feels serious but still accessible, OMUN is a strong bet.","Opening ceremonies -> Committee sessions -> Working paper drafting -> Draft resolution debate -> Voting and awards","High school students (typically Grade 9-12); participation as a school delegation is common","1. Go to the OMUN site. 2. Create or locate delegation registration. 3. Submit delegation size and school details. 4. Pay fees. 5. Complete country and committee selections by the deadlines posted.","mun|high-school|canada|ontario|resolution-writing","https://www.ontariomun.com/","https://www.ontariomun.com/"
"Alberta Model United Nations (ABMUN)","MUN","In-Person","Canada","High School","TBA (see official listing)","ABMUN is a key Western Canada conference and a reliable choice for schools that want competitive debate without needing international travel. It is especially good for building confidence in formal procedure and structured resolution work. Many delegates use ABMUN as a stepping stone before aiming for bigger North American conferences.","Opening session -> Committee debate -> Draft resolution process -> Voting and awards","High school students (typically Grade 8-12); school delegations and independent delegates depending on conference policy","1. Open the high school MUN conferences directory. 2. Search for ABMUN and follow the host link. 3. Register your school delegation or individual entry. 4. Pay fees if required. 5. Submit preferences and required documents by the listed deadlines.","mun|high-school|canada|alberta|debate","https://bestdelegate.com/high-school-model-united-nations-conferences/","https://bestdelegate.com/high-school-model-united-nations-conferences/"
"Vancouver Model United Nations (VMUN)","MUN","In-Person","Canada","High School","TBA (see official listing)","VMUN is one of the best known student conferences on the Canadian West Coast and is popular because it combines strong educational value with real competition. It is especially good for newer delegates who want to learn procedure quickly, while still being challenging enough for experienced students to push for awards. If your goal is skill growth plus a solid conference reputation, VMUN fits.","Opening ceremonies -> Committee sessions -> Working papers -> Draft resolutions -> Voting and awards","High school students (typically Grade 8-12); school delegations and independent delegates depending on conference policy","1. Open the high school MUN conferences directory. 2. Find VMUN and follow its host link. 3. Register the delegation or individual spot if allowed. 4. Pay fees. 5. Confirm committee assignments and prep position papers if required.","mun|high-school|canada|vancouver|training","https://bestdelegate.com/high-school-model-united-nations-conferences/","https://bestdelegate.com/high-school-model-united-nations-conferences/"
"Southern Ontario Model United Nations Assembly (SOMA)","MUN","In-Person","Canada","High School","TBA (see official listing)","SOMA is a strong regional conference for building practical committee instincts, especially for delegates who want lots of speaking time and negotiation reps. It is often a circuit favorite because it is accessible, well attended, and good for team development across a whole delegation. If your school wants a dependable competition to train newer delegates while still giving seniors a challenge, SOMA works well.","Opening session -> Committee debate -> Draft resolutions -> Voting and awards","High school students (typically Grade 8-12); school delegations and independent delegates depending on conference policy","1. Open the high school MUN conferences directory. 2. Locate SOMA and open the host page. 3. Register your delegation or individual entry. 4. Pay fees if needed. 5. Submit preferences and any required paperwork before the posted deadline.","mun|high-school|canada|ontario|regional","https://bestdelegate.com/high-school-model-united-nations-conferences/","https://bestdelegate.com/high-school-model-united-nations-conferences/"
"Secondary Schools United Nations Symposium (SSUNS)","MUN","In-Person","Canada","High School","TBA (see official listing)","SSUNS is a respected Montreal circuit event that many schools value for its educational focus and strong committee culture. It is a great place to practice resolution writing, bloc leadership, and consensus building in a setting that still takes awards seriously. If you want a credible Canadian conference with a classic committee experience, SSUNS is a solid option.","Opening session -> Committee sessions -> Working papers -> Draft resolutions -> Voting and awards","High school students (typically Grade 8-12); school delegations are common","1. Open the high school MUN conferences directory. 2. Find SSUNS and follow the host link. 3. Register your school delegation. 4. Pay fees if required. 5. Complete country and committee selections and submit position papers if required.","mun|high-school|canada|montreal|committee","https://bestdelegate.com/high-school-model-united-nations-conferences/","https://bestdelegate.com/high-school-model-united-nations-conferences/"
"Montreal United Nations Conference (MUNC)","MUN","In-Person","Canada","High School","TBA (see official listing)","MUNC is a well known Montreal area high school conference that is popular because it offers a strong delegate experience without the complexity and cost of international travel. It is especially useful for schools building depth in their MUN program, since it supports both newer and more experienced delegates. Expect a structured schedule, clear procedure, and plenty of negotiation time.","Opening ceremonies -> Committee debate -> Drafting and merging -> Voting and awards","High school students (typically Grade 8-12); school delegations and independent delegates depending on conference policy","1. Open the high school MUN conferences directory. 2. Locate MUNC and open the host page. 3. Register your delegation or individual entry as permitted. 4. Pay fees. 5. Submit preferences and required documents by deadlines.","mun|high-school|canada|montreal|debate","https://bestdelegate.com/high-school-model-united-nations-conferences/","https://bestdelegate.com/high-school-model-united-nations-conferences/"
"St. Andrew’s College Model United Nations (SACMUN)","MUN","In-Person","Canada","High School","TBA (see official listing)","SACMUN is a strong school hosted conference in Ontario that delegates often recommend for its organized flow and good committee pacing. It is a great environment to practice being strategic with speeches, amendments, and coalition management. If you want a polished conference experience that still feels student centered, SACMUN is worth targeting.","Opening session -> Committee sessions -> Working papers -> Draft resolutions -> Voting and awards","High school students (typically Grade 8-12); usually registered through schools","1. Open the high school MUN conferences directory. 2. Find SACMUN and follow its host link. 3. Register as a school delegation. 4. Pay fees if required. 5. Submit country and committee preferences and any position papers by deadlines.","mun|high-school|canada|ontario|school-hosted","https://bestdelegate.com/high-school-model-united-nations-conferences/","https://bestdelegate.com/high-school-model-united-nations-conferences/"
"Appleby College Model United Nations (ACMUN)","MUN","In-Person","Canada","High School","TBA (see official listing)","Appleby College’s ACMUN is a reputable Ontario circuit conference that is often praised for tight logistics and a strong delegate experience. It is especially good for developing practical skills like drafting clean clauses, negotiating merges, and maintaining decorum under pressure. Many delegations treat it as a dependable competitive stop in the spring season.","Opening session -> Committee debate -> Working papers -> Draft resolutions -> Voting and awards","High school students (typically Grade 8-12); registration usually through schools","1. Open the high school MUN conferences directory. 2. Locate ACMUN and open Appleby’s host page. 3. Register your school delegation. 4. Pay fees if needed. 5. Submit preferences and required documents by posted deadlines.","mun|high-school|canada|ontario|resolution-writing","https://bestdelegate.com/high-school-model-united-nations-conferences/","https://bestdelegate.com/high-school-model-united-nations-conferences/"
"Bishop Strachan School Model United Nations (BSSMUN)","MUN","In-Person","Canada","High School","TBA (see official listing)","BSSMUN is a recognized Toronto circuit conference with a reputation for solid chairing and a serious committee atmosphere. It is a strong choice if you want a conference that rewards both procedural fluency and real policy substance, not just loud speaking. Delegations often use it as a benchmark event for judging progress across the season.","Opening ceremonies -> Committee sessions -> Drafting and negotiation -> Voting and awards","High school students (typically Grade 8-12); school delegations are typical","1. Open the high school MUN conferences directory. 2. Find BSSMUN and follow the host link. 3. Register your delegation. 4. Pay fees. 5. Complete assignments and submit position papers if required.","mun|high-school|canada|toronto|competitive","https://bestdelegate.com/high-school-model-united-nations-conferences/","https://bestdelegate.com/high-school-model-united-nations-conferences/"
"Branksome Hall Model United Nations (BH MUN)","MUN","In-Person","Canada","High School","TBA (see official listing)","BH MUN is a well known Toronto area conference that is often chosen for its accessible but competitive structure. It is a great event for newer delegates to gain confidence while still giving experienced delegates room to lead blocs and drive outcomes. If your school wants a reliable conference that is widely recognized on the circuit, BH MUN fits.","Opening session -> Committee debates -> Working papers -> Draft resolutions -> Voting and awards","High school students (typically Grade 8-12); school delegations and independent delegates depending on conference policy","1. Open the high school MUN conferences directory. 2. Locate BH MUN and open the host page. 3. Register delegation or individual entry as allowed. 4. Pay fees. 5. Submit preferences and required documents by deadlines.","mun|high-school|canada|toronto|training","https://bestdelegate.com/high-school-model-united-nations-conferences/","https://bestdelegate.com/high-school-model-united-nations-conferences/"
"Upper Canada College Model United Nations (UCCMUN)","MUN","In-Person","Canada","High School","TBA (see official listing)","UCCMUN is part of the Toronto circuit and is known for strong student leadership, clear logistics, and an environment that rewards disciplined diplomacy. It is a good place to practice writing persuasive resolutions and managing merges without losing procedural accuracy. Delegations often attend because it is reputable, consistent, and challenging in a fair way.","Opening ceremonies -> Committee sessions -> Drafting and merging -> Voting and awards","High school students (typically Grade 8-12); typically school delegations","1. Open the high school MUN conferences directory. 2. Find UCCMUN and follow the host link. 3. Register the delegation. 4. Pay fees if required. 5. Submit committee and country preferences, plus position papers if required.","mun|high-school|canada|toronto|diplomacy","https://bestdelegate.com/high-school-model-united-nations-conferences/","https://bestdelegate.com/high-school-model-united-nations-conferences/"
"Toronto Model United Nations (TMUN)","MUN","In-Person","Canada","High School","TBA (see official listing)","TMUN is a classic Toronto circuit conference that many schools use for both training and competition. It is particularly good for delegates who want lots of practice with speeches, amendments, and resolution structure in a realistic committee setting. If you want a recognized conference that is widely attended and consistently run, TMUN is a dependable choice.","Opening session -> Committee debate -> Working papers -> Draft resolutions -> Voting and awards","High school students (typically Grade 8-12); school delegations and independent delegates depending on conference policy","1. Open the high school MUN conferences directory. 2. Locate TMUN and follow the registration link. 3. Register your delegation or individual entry as allowed. 4. Pay fees. 5. Confirm assignments and submit any required documents.","mun|high-school|canada|toronto|procedure","https://bestdelegate.com/high-school-model-united-nations-conferences/","https://bestdelegate.com/high-school-model-united-nations-conferences/"
"Kingswood Oxford Model United Nations (KOMUN)","MUN","In-Person","USA","High School","TBA (see official site)","KOMUN is a respected New England regional conference and a strong choice for delegates who want a well structured committee experience without needing a massive travel budget. It is known for clear procedure and a schedule that gives delegates time to draft, negotiate, and polish outcomes. If you want a serious regional conference that still feels student friendly, KOMUN is a strong option.","Opening ceremonies -> Committee sessions -> Working papers and drafting -> Voting and awards","Middle school and high school students (typically Grades 7-12); check conference policy for grade bands","1. Go to the official KOMUN page. 2. Locate registration for schools or delegates. 3. Submit delegation details and pay fees if required. 4. Select committees and countries. 5. Prepare position papers if required and attend conference.","mun|high-school|usa|new-england|regional","https://www.kingswoodoxford.org/komun-2026/","https://www.kingswoodoxford.org/komun-2026/"
"Iowa High School Model United Nations (IHSMUN)","MUN","In-Person","USA","High School","TBA (see official site)","IHSMUN is a long running conference that is especially valued for its education first approach while still offering a competitive committee environment. It is a great place to learn the fundamentals of procedure and resolution writing, and it is often recommended for delegates building strong core skills. If you want a reputable US conference with a clear learning curve, IHSMUN is a smart pick.","Opening session -> Committee debate -> Draft resolution development -> Voting and awards","High school students (typically Grades 9-12); participation as school delegations is common","1. Open the official IHSMUN conference page. 2. Follow the registration instructions for schools or individuals. 3. Submit delegation information. 4. Confirm fees and deadlines. 5. Complete assignments and submit any required position papers.","mun|high-school|usa|midwest|skills","https://csbs.uni.edu/history/history/IHSMUN/spring-2026-conference","https://csbs.uni.edu/history/history/IHSMUN/spring-2026-conference"
"Chicago International Model United Nations (CIMUN)","MUN","In-Person","USA","High School","TBA (see official listing)","CIMUN is an internationally themed high school conference that gives delegates exposure to a wide committee range and a more global delegate mix than many local events. It is a strong option for students who want a serious conference experience in a major US city without needing to attend the very top tier mega conferences. Expect a structured pace and lots of drafting time.","Opening ceremonies -> Committee sessions -> Working papers -> Draft resolutions -> Voting and awards","High school students (typically Grade 9-12); school delegations and independent delegates depending on conference policy","1. Open the official listing. 2. Find CIMUN and follow its host link. 3. Register delegation or individual entry. 4. Pay fees if applicable. 5. Confirm committee assignments and complete required submissions.","mun|high-school|usa|chicago|international","https://en.wikipedia.org/wiki/List_of_model_United_Nations_conferences","https://en.wikipedia.org/wiki/List_of_model_United_Nations_conferences"
"Mid-American Model United Nations (MAMUN)","MUN","In-Person","USA","High School","TBA (see official site)","MAMUN is a well established Midwestern conference with a reputation for consistent organization and a solid committee experience. It is a great place to practice drafting and merging under realistic time pressure, and it tends to attract delegations that take preparation seriously. If you want a dependable US conference that rewards both diplomacy and procedure, MAMUN is a strong choice.","Opening session -> Committee debate -> Working papers -> Draft resolutions -> Voting and awards","High school students (typically Grade 9-12); registration usually via schools","1. Go to the MAMUN calendar page. 2. Find the relevant conference entry and deadlines. 3. Register your school delegation. 4. Pay fees as required. 5. Submit committee and country preferences plus any required documents.","mun|high-school|usa|midwest|resolution","https://www.mamunonline.com/calendar","https://www.mamunonline.com/calendar"
"Clinton Model United Nations Conference (ClintonMUNC)","MUN","In-Person","USA","High School","TBA (see directory)","ClintonMUNC is a regional high school conference that can be a great practical event for delegates who want lots of reps in speaking, negotiation, and clause writing. Conferences like this are often where students level up quickly because the committees are active and the learning is hands on. It is a smart option for building confidence before tackling bigger national conferences.","Opening session -> Committee sessions -> Drafting and negotiation -> Voting and awards","High school students (typically Grade 8-12); check whether schools only or individual delegates are allowed","1. Open the high school MUN conferences directory. 2. Search for ClintonMUNC and open its host link. 3. Register delegation or individual entry as allowed. 4. Pay fees if required. 5. Confirm assignments and submit any required documents.","mun|high-school|usa|regional|training","https://bestdelegate.com/high-school-model-united-nations-conferences/","https://bestdelegate.com/high-school-model-united-nations-conferences/"
"Carl Sandburg Model United Nations (CSMUN)","MUN","In-Person","USA","High School","TBA (see directory)","CSMUN is a school based conference that works well as a competitive training event for delegates who want a realistic committee setting without the pressure of a mega conference. It is especially useful for practicing writing clean operative clauses, negotiating merges, and using procedure strategically. For many delegations, events like CSMUN are where you build the basics that later win awards at larger conferences.","Opening session -> Committee debate -> Working papers -> Draft resolutions -> Voting and awards","High school students (typically Grade 8-12); usually registered through schools","1. Open the high school MUN conferences directory. 2. Find CSMUN and follow the host link. 3. Register your school delegation. 4. Pay fees if needed. 5. Submit preferences and any position papers by the conference deadlines.","mun|high-school|usa|illinois|school-hosted","https://bestdelegate.com/high-school-model-united-nations-conferences/","https://bestdelegate.com/high-school-model-united-nations-conferences/"
"Virginia Tech Model United Nations Conference (VTMUNC)","MUN","In-Person","USA","High School","TBA (see directory)","VTMUNC is a well known high school event hosted in a university environment, which often means strong staffing and structured committees. It is a great option for delegates who want a serious conference experience while still being accessible for schools that do not travel internationally. Expect a clear schedule, a strong focus on drafting outcomes, and a competitive awards culture.","Opening ceremonies -> Committee sessions -> Drafting and merging -> Voting and awards","High school students (typically Grade 9-12); school delegations are common","1. Open the high school MUN conferences directory. 2. Find VTMUNC and open the host link. 3. Register delegation size and school details. 4. Pay fees if required. 5. Submit committee preferences and required documents by the listed deadlines.","mun|high-school|usa|virginia|competitive","https://bestdelegate.com/high-school-model-united-nations-conferences/","https://bestdelegate.com/high-school-model-united-nations-conferences/"
"Cornell Model United Nations Conference (CMUNC)","MUN","In-Person","USA","High School","TBA (see official listing)","CMUNC is a respected high school conference that benefits from being hosted in an academically intense environment. It is often chosen by experienced delegations because it rewards well researched policy positions and disciplined negotiation. If you want a conference that pushes delegates to be sharp, strategic, and prepared, CMUNC is a strong option.","Opening session -> Committee debates -> Working papers -> Draft resolutions -> Voting and awards","High school students (typically Grade 9-12); registration usually through schools","1. Open the official listing. 2. Locate CMUNC and follow the host link. 3. Register your delegation. 4. Pay fees if applicable. 5. Confirm assignments and submit position papers if required.","mun|high-school|usa|ivy-style|policy","https://en.wikipedia.org/wiki/List_of_model_United_Nations_conferences","https://en.wikipedia.org/wiki/List_of_model_United_Nations_conferences"
"Dartmouth Model United Nations (DartMUN)","MUN","In-Person","USA","High School","TBA (see official listing)","DartMUN is a well regarded high school conference that often attracts strong delegations looking for a rigorous committee experience. It is a good place to practice high level strategy, including bloc formation, amendment timing, and coalition management. If you want a conference that feels competitive and rewards preparation, DartMUN fits.","Opening ceremonies -> Committee sessions -> Drafting and negotiation -> Voting and awards","High school students (typically Grade 9-12); usually registered through schools","1. Open the official listing. 2. Find DartMUN and open the host page. 3. Register your school delegation. 4. Pay any fees required. 5. Complete preferences and submit required documents by deadlines.","mun|high-school|usa|new-england|rigor","https://en.wikipedia.org/wiki/List_of_model_United_Nations_conferences","https://en.wikipedia.org/wiki/List_of_model_United_Nations_conferences"
